{"$id":"oh.war/runtime-native-policy-binding/v1-draft.1","$schema":"https://json-schema.org/draft/2020-12/schema","additionalProperties":false,"description":"Exact policy observations for a future versioned native acceptance response.\nDeserializing these identifiers does not authenticate a host or grant access.","properties":{"active_enrollment_digest":{"type":"string"},"authority_digest":{"type":"string"},"collector":{"type":"string"},"host_configuration_digest":{"type":"string"},"native_configuration_digest":{"type":"string"},"repository":{"type":"string"},"schema":{"const":"oh.war/runtime-native-policy-binding/v1-draft.1","type":"string"}},"required":["schema","repository","collector","authority_digest","active_enrollment_digest","host_configuration_digest","native_configuration_digest"],"title":"NativePolicyBinding","type":"object"}
