{"active_enrollment_digest":"sha256:0000000000000000000000000000000000000000000000000000000000000000","authority_digest":"sha256:0000000000000000000000000000000000000000000000000000000000000000","collector":"example-only","host_configuration_digest":"sha256:0000000000000000000000000000000000000000000000000000000000000000","native_configuration_digest":"sha256:0000000000000000000000000000000000000000000000000000000000000000","repository":"example-only","schema":"oh.war/runtime-native-policy-binding/v1-draft.1"}
